{
  "$ref": "#/definitions/components",
  "definitions": {
    "components": {
      "type": "object",
      "properties": {
        "name": {
          "type": "string"
        },
        "slug": {
          "type": "string"
        },
        "description": {
          "anyOf": [
            {
              "anyOf": [
                {
                  "not": {}
                },
                {
                  "type": "string"
                }
              ]
            },
            {
              "type": "null"
            }
          ]
        },
        "figmaUrl": {
          "anyOf": [
            {
              "anyOf": [
                {
                  "not": {}
                },
                {
                  "type": "string"
                }
              ]
            },
            {
              "type": "null"
            }
          ]
        },
        "storybookUrl": {
          "anyOf": [
            {
              "anyOf": [
                {
                  "not": {}
                },
                {
                  "type": "string"
                }
              ]
            },
            {
              "type": "null"
            }
          ]
        },
        "docsUrl": {
          "anyOf": [
            {
              "anyOf": [
                {
                  "not": {}
                },
                {
                  "type": "string"
                }
              ]
            },
            {
              "type": "null"
            }
          ]
        },
        "$schema": {
          "type": "string"
        }
      },
      "required": [
        "name",
        "slug"
      ],
      "additionalProperties": false
    }
  },
  "$schema": "http://json-schema.org/draft-07/schema#"
}